{
  "schema_version": "1.3.0",
  "contract_set": "1.1.0",
  "competition_id": "agenthon2026-analysis-final",
  "track": "analysis",
  "phase": "final",
  "plan_id": "plan-analysis-final-0002-scorer-5.1.0-TEST-FIXTURE-not-a-signature",
  "metric": {
    "direction": "desc",
    "domain": {
      "min": 0.0,
      "max": 1.0
    },
    "statistic": "mean",
    "unit_scope": "per_unit"
  },
  "roster": {
    "count": 2,
    "digest": "sha256:5371857ddfcfbb4ae34547b3e5d55c8de4b4c8226a5e71035917df8e08704e51",
    "expected_units": [
      {
        "unit_handle": "u-644dc0d6eda4da5f",
        "entity_roster": {
          "count": 2,
          "digest": "sha256:82ae4990da00b7e6997c117c242b553a93f6dfb6721f5a30b9c5ea55b79b9f7f",
          "entity_ids": [
            "ent-0001",
            "ent-0002"
          ]
        },
        "scoring_params": {
          "faithfulness_threshold": 0.8,
          "tau_citation": 0.6,
          "interval_level": 0.9,
          "composite_weights": {
            "accuracy": 0.7,
            "calibration": 0.3
          },
          "target_type": "classification",
          "interval_leg": true,
          "labels": [
            "up",
            "down"
          ]
        }
      },
      {
        "unit_handle": "u-7d3e59dda332e290",
        "entity_roster": {
          "count": 2,
          "digest": "sha256:82484fe85543045eed9f94e92c78851cf423980660b660cc9600cde025dd9cf2",
          "entity_ids": [
            "ent-0001",
            "ent-0002"
          ]
        },
        "scoring_params": {
          "faithfulness_threshold": 0.8,
          "tau_citation": 0.6,
          "interval_level": 0.9,
          "composite_weights": {
            "accuracy": 0.7,
            "calibration": 0.3
          },
          "target_type": "regression"
        }
      }
    ]
  },
  "participant_failure": {
    "policy": "fixed_worst_case",
    "score": 0.0,
    "by_code": {},
    "clip_real_scores_to_domain": true
  },
  "organizer_failure": {
    "policy": "abort_whole_evaluation"
  },
  "scorer": {
    "package": "qfbench2_track_analysis",
    "digest": "sha256:45dc19385d1820408c86213e103d886971c69d5c9d05b834502c859aef135528",
    "interface_version": "2.0"
  },
  "required_evidence": {
    "c2": true,
    "c3": true,
    "telemetry": false,
    "judge": true
  },
  "signature": {
    "alg": "Ed25519",
    "key_id": "dev-organizer-2026",
    "payload_digest": "sha256:567e41abcc893d3b8457304fad12a1b99495cb4bc23cf2b4dcb4254af844b4b4",
    "signed_at": "2026-09-24T12:00:00Z",
    "signature": "47zFzzvL0Yf0hZ0Lb5hogQZfYlya+Feml/I8LCZVX4QbxvBL81KP5vni1YopmKLS2geWrp4N9u/HtvaCY879Bg=="
  }
}
